{"name":"nestjs_template","desc":"","tables":[{"name":"__drizzle_migrations","type":"BASE TABLE","comment":"","columns":[{"name":"id","type":"bigint(20) unsigned","nullable":false,"default":null,"comment":"","extra_def":"auto_increment"},{"name":"hash","type":"text","nullable":false,"default":null,"comment":""},{"name":"created_at","type":"bigint(20)","nullable":true,"default":null,"comment":""}],"indexes":[{"name":"PRIMARY","def":"PRIMARY KEY (id) USING BTREE","table":"__drizzle_migrations","columns":["id"],"comment":""},{"name":"id","def":"UNIQUE KEY id (id) USING BTREE","table":"__drizzle_migrations","columns":["id"],"comment":""}],"constraints":[{"name":"id","type":"UNIQUE","def":"UNIQUE KEY id (id)","table":"__drizzle_migrations","referenced_table":null,"columns":["id"],"referenced_columns":null,"comment":""},{"name":"PRIMARY","type":"PRIMARY KEY","def":"PRIMARY KEY (id)","table":"__drizzle_migrations","referenced_table":null,"columns":["id"],"referenced_columns":null,"comment":""}],"triggers":[],"def":"CREATE TABLE `__drizzle_migrations` (\n  `id` bigint(20) unsigned NOT NULL AUTO_INCREMENT,\n  `hash` text COLLATE utf8mb4_unicode_ci NOT NULL,\n  `created_at` bigint(20) DEFAULT NULL,\n  PRIMARY KEY (`id`),\n  UNIQUE KEY `id` (`id`)\n) ENGINE=InnoDB DEFAULT CHARSET=utf8mb4 COLLATE=utf8mb4_unicode_ci"},{"name":"users","type":"BASE TABLE","comment":"","columns":[{"name":"id","type":"bigint(20) unsigned","nullable":false,"default":null,"comment":"","extra_def":"auto_increment"},{"name":"email","type":"varchar(256)","nullable":false,"default":null,"comment":""},{"name":"name","type":"varchar(256)","nullable":false,"default":null,"comment":""},{"name":"is_admin","type":"tinyint(1)","nullable":false,"default":"0","comment":""},{"name":"detail","type":"text","nullable":false,"default":null,"comment":""},{"name":"created_at","type":"timestamp","nullable":false,"default":"CURRENT_TIMESTAMP","comment":""},{"name":"updated_at","type":"timestamp","nullable":false,"default":"CURRENT_TIMESTAMP","extra_def":"on update CURRENT_TIMESTAMP","comment":""}],"indexes":[{"name":"PRIMARY","def":"PRIMARY KEY (id) USING BTREE","table":"users","columns":["id"],"comment":""},{"name":"id","def":"UNIQUE KEY id (id) USING BTREE","table":"users","columns":["id"],"comment":""},{"name":"users_email_unique","def":"UNIQUE KEY users_email_unique (email) USING BTREE","table":"users","columns":["email"],"comment":""}],"constraints":[{"name":"id","type":"UNIQUE","def":"UNIQUE KEY id (id)","table":"users","referenced_table":null,"columns":["id"],"referenced_columns":null,"comment":""},{"name":"PRIMARY","type":"PRIMARY KEY","def":"PRIMARY KEY (id)","table":"users","referenced_table":null,"columns":["id"],"referenced_columns":null,"comment":""},{"name":"users_email_unique","type":"UNIQUE","def":"UNIQUE KEY users_email_unique (email)","table":"users","referenced_table":null,"columns":["email"],"referenced_columns":null,"comment":""}],"triggers":[],"def":"CREATE TABLE `users` (\n  `id` bigint(20) unsigned NOT NULL AUTO_INCREMENT,\n  `email` varchar(256) COLLATE utf8mb4_unicode_ci NOT NULL,\n  `name` varchar(256) COLLATE utf8mb4_unicode_ci NOT NULL,\n  `is_admin` tinyint(1) NOT NULL DEFAULT '0',\n  `detail` text COLLATE utf8mb4_unicode_ci NOT NULL,\n  `created_at` timestamp NOT NULL DEFAULT CURRENT_TIMESTAMP,\n  `updated_at` timestamp NOT NULL DEFAULT CURRENT_TIMESTAMP ON UPDATE CURRENT_TIMESTAMP,\n  PRIMARY KEY (`id`),\n  UNIQUE KEY `id` (`id`),\n  UNIQUE KEY `users_email_unique` (`email`)\n) ENGINE=InnoDB DEFAULT CHARSET=utf8mb4 COLLATE=utf8mb4_unicode_ci"}],"relations":[],"functions":[],"driver":{"name":"mysql","database_version":"5.7.44-log","meta":{"dict":{"Functions":"Stored procedures and functions"}}}}
